sentence_id,title,origin_sentence,paragraph_text,query number,clean_sentence,tagger,status
75008,ME-16-02-2193-22,"מהימנות עדות המתלוננת עדותה של המתלוננת קוהרנטית, אותנטית, עקבית ומעוררת אמון והיא גם עשתה מאמץ להיצמד לאמת ולהימנע מהגזמה","מהימנות עדות המתלוננת עדותה של המתלוננת קוהרנטית, אותנטית, עקבית ומעוררת אמון והיא גם עשתה מאמץ להיצמד לאמת ולהימנע מהגזמה. המתלוננת לא ניסתה להעצים את האירוע. אני נותן אמון מלא בעדות המתלוננת. המתלוננת נחקרה ארוכות בנוגע לפרטי האירוע וניכר היה כי המתלוננת מעידה מדם ליבה: המתלוננת היתה עקבית בתיאורה את האירוע, היא לא ניסתה להעצים את פרטי האירוע והשתדלה לדייק בתיאור מעשיו של הנאשם – המתלוננת חזרה מספר פעמים על כך שהאירוע נמשך לכל היותר כ- 40 שניות. המתלוננת ציינה ""עמדתי פשוט לא רחוק ממנו... הוא הושיט לי את שתי הידיים והושיב אותי על הברכיים... אני עם הגב אליו, כשאני כמובן עם בגדים, הוא נוגע לי מעל הבגדים בחזה, מסובב לי את הראש ומנשק אותי, או מנסה לפחות"". כשנשאלה מה זה אומר ""מנסה"" לנשק, השיבה ""שהרגשתי... את הלשון שלו.. על השפתיים שלי"". ברגע זה, לדבריה, היא התעשתה, שחררה את אחיזתו על ידי המרפק, הרביצה לו מכעס וברחה. ב""כ הנאשם הטיח במתלוננת את האפשרות שתיאמה עם בת דודתה את הגשת התלונה לאחר שגם בת דודתה הגישה תלונה נגד הנאשם, המתלוננת השיבה, שהמעשים המיוחסים לנאשם בתיק הנוגע לבת דודתה מספיק חמורים על מנת שהוא יקבל את עונשו ולכאורה לא היתה סיבה שתתאם איתה את הגשת התלונה ""שאני אוסיף את השלושים שניות האלה. כי אצלי זה היה שלושים שניות, שם זה היה כמה שנים"". ניכר, כי המתלוננת אינה מנסה להעצים את פרטי האירוע, דבקה בעובדות כפי שהתרחשו ואף מודעת לפער הקיים בין חומרת האירוע שהיא חוותה ובין חומרת האירועים האחרים שיוחסו לנאשם בתיק אחר.",1,"מהימנות עדות המתלוננת עדותה של המתלוננת קוהרנטית, אותנטית, עקבית ומעוררת אמון והיא גם עשתה מאמץ להיצמד לאמת ולהימנע מהגזמה",tagger3,not annotated
229857,ME-13-03-23362-44,"דיון בראיות הישירות: אקדים ואומר - נמצא לי, שעדות המתלוננת אמינה וראויה למתן משקל רב, וכי, שטחה בפנינו  את אשר אירע לה באמת ובתמים: סאגה של פגיעה מינית בה, ואלימות אחרת, מצד אביה- הנאשם, לאורך שנים ארוכות","דיון בראיות הישירות: אקדים ואומר - נמצא לי, שעדות המתלוננת אמינה וראויה למתן משקל רב, וכי, שטחה בפנינו  את אשר אירע לה באמת ובתמים: סאגה של פגיעה מינית בה, ואלימות אחרת, מצד אביה- הנאשם, לאורך שנים ארוכות. מתוך שנים אלה - התקופה, שעליה מבקשת המאשימה להרשיעו, היא ממועד עליית המשפחה ארצה בשנת 2009 ועד הגשת התלונה, בשלהי פברואר 2013.",3,"דיון בראיות הישירות: אקדים ואומר - נמצא לי, שעדות המתלוננת אמינה וראויה למתן משקל רב, וכי, שטחה בפנינו  את אשר אירע לה באמת ובתמים: סאגה של פגיעה מינית בה, ואלימות אחרת, מצד אביה- הנאשם, לאורך שנים ארוכות",tagger3,not annotated
525555,m03001069," לעומת גירסתה הברורה והאֲמִינָה של המתלוננת, והתוספות הרְאָיָיתִיוֹת המאמתות וּמעבּוֹת אותה, גירסתו של הנאשם איננה אֲמִינָה ואינה משכנעת כְּלָל ועיקר","(ג) וּלעניין מהימנוּתוֹ של הנאשם 90. לעומת גירסתה הברורה והאֲמִינָה של המתלוננת, והתוספות הרְאָיָיתִיוֹת המאמתות וּמעבּוֹת אותה, גירסתו של הנאשם איננה אֲמִינָה ואינה משכנעת כְּלָל ועיקר. עם זאת, גם בדבריו ניתן למצוא אלמנטים המחזקים ואף מאמתים את גירסת המתלוננת.",5," לעומת גירסתה הברורה והאֲמִינָה של המתלוננת, והתוספות הרְאָיָיתִיוֹת המאמתות וּמעבּוֹת אותה, גירסתו של הנאשם איננה אֲמִינָה ואינה משכנעת כְּלָל ועיקר",tagger3,not annotated
81797,m02001201-a,"ראשית, עדותה של המתלוננת בעייתית, שכן אין זה מובן מדוע התביישה משותפתה לדירה, שמא זו תראה את הקונדום","ראשית, עדותה של המתלוננת בעייתית, שכן אין זה מובן מדוע התביישה משותפתה לדירה, שמא זו תראה את הקונדום. הסבר זה אינו סביר בהתחשב בעובדה שהמתלוננת תיארה יחסי חברות בינה לבין שותפתה, והן בהתחשב בעובדה שסיפרה לה אודות האינוס מיד עם חזרתה מתחנת המשטרה. כשנשאלה על כך בעדותה החוזרת, השיבה: ""בהתחלה התביישתי אבל החלטתי שאני אספר לה, לשותפה שלי, אחרי שחזרתי מתחנת המשטרה"" (עמ' 197, שורה 19 לפרוטוקול).",1,"ראשית, עדותה של המתלוננת בעייתית, שכן אין זה מובן מדוע התביישה משותפתה לדירה, שמא זו תראה את הקונדום",tagger3,not annotated
623219,m99000907,"המסקנה היא, שעדות המתלוננת היא מהימנה ולא רק בגלל שהיא נתמכת בעדותה של טטיאנה שפוצ'ניקוב, אלא משום שכל הופעתה בבית המשפט היתה הופעה של בחורה, שאיננה רוצה לתאר יותר ממה שקרה לה, אבל היא מתארת בדיוק את מה שהיא זוכרת","המסקנה היא, שעדות המתלוננת היא מהימנה ולא רק בגלל שהיא נתמכת בעדותה של טטיאנה שפוצ'ניקוב, אלא משום שכל הופעתה בבית המשפט היתה הופעה של בחורה, שאיננה רוצה לתאר יותר ממה שקרה לה, אבל היא מתארת בדיוק את מה שהיא זוכרת.",3,"המסקנה היא, שעדות המתלוננת היא מהימנה ולא רק בגלל שהיא נתמכת בעדותה של טטיאנה שפוצ'ניקוב, אלא משום שכל הופעתה בבית המשפט היתה הופעה של בחורה, שאיננה רוצה לתאר יותר ממה שקרה לה, אבל היא מתארת בדיוק את מה שהיא זוכרת",tagger3,not annotated
528108,ME-12-03-25945-23," גירסתה המהימנה של המתלוננת והחיזוקים לה, בעינם עומדים, ובהיעדר ממצא כטענות ההגנה, אין כדי להעלות או להוריד; באותה מידה לא נמצא פרופיל DNA של המתלוננת במוצגים שנלקחו מהחדר (למשל כיסוי כרית ומיטה – נ/8, ע' 2-3), והרי אין חולק כי הנאשם והמתלוננת ישבו על הספה והתנשקו","ב. מיד אחרי האירוע הנאשם עזב את המסיבה, ונעצר בביתו מספר שעות לאחר מכן (ת/9, ת/10; עדות הנאשם בביהמ""ש – ע' 38 לפר' מיום 31.10.12, ש' 20-22, ע' 45 לפר', שו' 19-20), ורק לאחר מכן נלקחו ממנו דגימות ולבוש ולא כשהנאשם עדיין במקום האירוע [בחווה""ד נ/8 נאמר לגבי הציפורניים, שלא התקבלה כמות DNA ראוייה להמשך הבדיקות (ע' 3, ס' 6)]. ג. גירסתה המהימנה של המתלוננת והחיזוקים לה, בעינם עומדים, ובהיעדר ממצא כטענות ההגנה, אין כדי להעלות או להוריד; באותה מידה לא נמצא פרופיל DNA של המתלוננת במוצגים שנלקחו מהחדר (למשל כיסוי כרית ומיטה – נ/8, ע' 2-3), והרי אין חולק כי הנאשם והמתלוננת ישבו על הספה והתנשקו.",5," גירסתה המהימנה של המתלוננת והחיזוקים לה, בעינם עומדים, ובהיעדר ממצא כטענות ההגנה, אין כדי להעלות או להוריד; באותה מידה לא נמצא פרופיל DNA של המתלוננת במוצגים שנלקחו מהחדר , והרי אין חולק כי הנאשם והמתלוננת ישבו על הספה והתנשקו",tagger3,not annotated
32520,m00000935-103,"00, בה חזרה המתלוננת על הגרסה המפלילה את הנאשם, קדמה לעדותה בקשת ב""כ המאשימה לאפשר לה להעיד פעם נוספת את המתלוננת, בנימוק שאם המתלוננת פנתה אליה, וביקשה לאפשר למתלוננת לשוב ולהעיד, וכן שיש בכך כדי לגרום לגילוי האמת","ה. ביחס לעדות השניה של המתלוננת בבית המשפט מיום 12.12.00, בה חזרה המתלוננת על הגרסה המפלילה את הנאשם, קדמה לעדותה בקשת ב""כ המאשימה לאפשר לה להעיד פעם נוספת את המתלוננת, בנימוק שאם המתלוננת פנתה אליה, וביקשה לאפשר למתלוננת לשוב ולהעיד, וכן שיש בכך כדי לגרום לגילוי האמת.",5,"00, בה חזרה המתלוננת על הגרסה המפלילה את הנאשם, קדמה לעדותה בקשת ב""כ המאשימה לאפשר לה להעיד פעם נוספת את המתלוננת, בנימוק שאם המתלוננת פנתה אליה, וביקשה לאפשר למתלוננת לשוב ולהעיד, וכן שיש בכך כדי לגרום לגילוי האמת",tagger3,not annotated
77678,m03001164,"שמענו את עֵדוּתָהּ הארוכה והמפורטת של המתלוננת, ויכולנו להתרשם בּאֹרַח בלתי-אמצעי מאוֹפיָיה, התנהגותה ואופן מסירת עֵדוּתָהּ, על רקע גִּילָהּ הצעיר וּמַצָּבַהּ המיוחד, וּלאורך חקירה לא-קלה","שמענו את עֵדוּתָהּ הארוכה והמפורטת של המתלוננת, ויכולנו להתרשם בּאֹרַח בלתי-אמצעי מאוֹפיָיה, התנהגותה ואופן מסירת עֵדוּתָהּ, על רקע גִּילָהּ הצעיר וּמַצָּבַהּ המיוחד, וּלאורך חקירה לא-קלה.",5,"שמענו את עֵדוּתָהּ הארוכה והמפורטת של המתלוננת, ויכולנו להתרשם בּאֹרַח בלתי-אמצעי מאוֹפיָיה, התנהגותה ואופן מסירת עֵדוּתָהּ, על רקע גִּילָהּ הצעיר וּמַצָּבַהּ המיוחד, וּלאורך חקירה לא-קלה",tagger3,not annotated
633015,s001440, ניתנת האמת להיאמר – גירסתה של המתלוננת בענין זה היא מבולבלת ולא אחידה,היא מאשרת את הנטען בכתב האישום כאילו הנאשם נשק על צווארה. ניתנת האמת להיאמר – גירסתה של המתלוננת בענין זה היא מבולבלת ולא אחידה.,1, ניתנת האמת להיאמר – גירסתה של המתלוננת בענין זה היא מבולבלת ולא אחידה,tagger3,not annotated
368231,m08000502-117,"קל וחומר, שאין לבסס הרשעה פלילית על פי עדותה הנ""ל של המתלוננת, שכן, ראינו, כי במשפט העברי הפלילי, רף הראיות הוא גבוה במיוחד","קל וחומר, שאין לבסס הרשעה פלילית על פי עדותה הנ""ל של המתלוננת, שכן, ראינו, כי במשפט העברי הפלילי, רף הראיות הוא גבוה במיוחד.",5,"קל וחומר, שאין לבסס הרשעה פלילית על פי עדותה הנ""ל של המתלוננת, שכן, ראינו, כי במשפט העברי הפלילי, רף הראיות הוא גבוה במיוחד",tagger3,not annotated
14173,m014025," כיוון שהנאשם אינו מודה במגע המיני, ואינו טוען שהדבר נעשה בהסכמת המתלוננת, המסקנה היחידה, לאור עדותה המהימנה של המתלוננת, היא שהמגע המיני היה באינוס, וכי הנאשם הוא האנס","ואכן, עתים, מבחינת ההסתברות, קל יותר להסביר הימצא טביעת אצבע על חפץ או על משטח גלוי, מהימצא החומר החשוד בתוך גוף הקורבן, למשל, כמו בעניננו, בתוך איבר מינה של המתלוננת. במקרה זה, אין הסבר אחר אלא שהנאשם החדיר את איבר מינו לאיבר מינה של המתלוננת. כיוון שהנאשם אינו מודה במגע המיני, ואינו טוען שהדבר נעשה בהסכמת המתלוננת, המסקנה היחידה, לאור עדותה המהימנה של המתלוננת, היא שהמגע המיני היה באינוס, וכי הנאשם הוא האנס.",5," כיוון שהנאשם אינו מודה במגע המיני, ואינו טוען שהדבר נעשה בהסכמת המתלוננת, המסקנה היחידה, לאור עדותה המהימנה של המתלוננת, היא שהמגע המיני היה באינוס, וכי הנאשם הוא האנס",tagger3,not annotated
626749,ME-10-01-24354-12,"(2) גרסתה של המתלוננת באשר לשאלה אם מעשי הנאשם הותירו על גופה סימנים, לא הייתה עקבית: - בעדותה מסרה המתלוננת כי הנאשם אמר לה שבכוונה אינו משאיר סימני אלימות על גופה, כדי שלא תוכל להתלונן במשטרה","(2) גרסתה של המתלוננת באשר לשאלה אם מעשי הנאשם הותירו על גופה סימנים, לא הייתה עקבית: - בעדותה מסרה המתלוננת כי הנאשם אמר לה שבכוונה אינו משאיר סימני אלימות על גופה, כדי שלא תוכל להתלונן במשטרה. כשהנאשם היה אונס אותה, הוא היה מפסק את רגליה בכוח ולפעמים היו נותרים סימנים, אך לא ""סימנים קשים"" (עמ' 38, ש' 12-10).",1," גרסתה של המתלוננת באשר לשאלה אם מעשי הנאשם הותירו על גופה סימנים, לא הייתה עקבית: - בעדותה מסרה המתלוננת כי הנאשם אמר לה שבכוונה אינו משאיר סימני אלימות על גופה, כדי שלא תוכל להתלונן במשטרה",tagger3,not annotated
755124,m07004030," טוענות הסנגוריות כי גרסתה החדשה של המתלוננת לסיבת הגעתה לדירת הנאשם, אך ממחישה את היות עדותה מופרכת וחסרת הגיון, שכן ""מדוע שהנאשם יאנוס אישה שממילא הייתה מתמסרת לו?"" -  אלא ששאלה זו אין בה כדי לערער את מהימנותה של המתלוננת כטענתן אלא היה מקום להפנותה אל הנאשם דווקא","92. טוענות הסנגוריות כי גרסתה החדשה של המתלוננת לסיבת הגעתה לדירת הנאשם, אך ממחישה את היות עדותה מופרכת וחסרת הגיון, שכן ""מדוע שהנאשם יאנוס אישה שממילא הייתה מתמסרת לו?"" -  אלא ששאלה זו אין בה כדי לערער את מהימנותה של המתלוננת כטענתן אלא היה מקום להפנותה אל הנאשם דווקא. התנהלות הנאשם הייתה סוטה, הוא שבחר להכות במתלוננת כבר ברגע היכנסה לדירה, הוא שדרש שתשתין לפיו, הוא שעמד לידה עת השתינה בשירותים, הוא שהזריק לעצמו לוריד תרופה שנועדה להילקח בכדורים, שלא עפ""י הוראות רופא (גם אם כדי להעלות את לחץ הדם) וכיוצ""ב, כפי שתיארתי כבר לעיל.",12," טוענות הסנגוריות כי גרסתה החדשה של המתלוננת לסיבת הגעתה לדירת הנאשם, אך ממחישה את היות עדותה מופרכת וחסרת הגיון, שכן ""מדוע שהנאשם יאנוס אישה שממילא הייתה מתמסרת לו?"" -  אלא ששאלה זו אין בה כדי לערער את מהימנותה של המתלוננת כטענתן אלא היה מקום להפנותה אל הנאשם דווקא",tagger3,not annotated
783388,m04001224-418," גרסתה של המתלוננת כי מכנסיה הוסרו ""בצד אחד"" בלבד, כי הסרת המכנסיים נעשתה באמצעות משיכה, כאשר היא איננה מרימה את אגן הירכיים, מתנגדת למעשי הנאשם ודוחפת אותו כל העת – כלל אינה אפשרית, אינה ברורה ותמוהה מאוד","גרסתה זו של המתלוננת הינה תמוהה ביותר. מניסיון החיים ברור, כי בלתי אפשרי להוריד מכנסיים ""בצד אחד"" כאשר הצד השני של המכנסיים נשאר ""שלם"" גם כאשר כפתורי המכנסיים פתוחים. למותר לציין, כי לא ניתן לקיים כך יחסי מין. גרסתה של המתלוננת כי מכנסיה הוסרו ""בצד אחד"" בלבד, כי הסרת המכנסיים נעשתה באמצעות משיכה, כאשר היא איננה מרימה את אגן הירכיים, מתנגדת למעשי הנאשם ודוחפת אותו כל העת – כלל אינה אפשרית, אינה ברורה ותמוהה מאוד. כך גם התעקשותה של המתלוננת על ההיגיון שבגרסתה. סבורתני, כי המתלוננת סברה שאם תעיד שמכנסיה הופשלו לחלוטין, היה הדבר מצביע על הסכמתה לכאורה, ובגרסתה ביקשה ליצור רושם כי אלו הוסרו בעל-כורחה כאשר מכנס אחד נשאר צמוד אליה, בשל התנגדותה.",1," גרסתה של המתלוננת כי מכנסיה הוסרו ""בצד אחד"" בלבד, כי הסרת המכנסיים נעשתה באמצעות משיכה, כאשר היא איננה מרימה את אגן הירכיים, מתנגדת למעשי הנאשם ודוחפת אותו כל העת – כלל אינה אפשרית, אינה ברורה ותמוהה מאוד",tagger3,not annotated
344853,m07004058,"מטבעם, מעשים כמיוחס לנאשם בכתב האישום, נעשים בדלת אמות ולא אחת ניצבת עדותה היחידה של המתלוננת למול עדות הנאשם, וכך גם במקרה דנן","מטבעם, מעשים כמיוחס לנאשם בכתב האישום, נעשים בדלת אמות ולא אחת ניצבת עדותה היחידה של המתלוננת למול עדות הנאשם, וכך גם במקרה דנן.",5,"מטבעם, מעשים כמיוחס לנאשם בכתב האישום, נעשים בדלת אמות ולא אחת ניצבת עדותה היחידה של המתלוננת למול עדות הנאשם, וכך גם במקרה דנן",tagger3,not annotated
489600,M003032,"עדות המתלוננת עקבית וברורה, ולא נמצאו סתירות בין הודעותיה במשטרה לבין עדותה","עדות המתלוננת עקבית וברורה, ולא נמצאו סתירות בין הודעותיה במשטרה לבין עדותה. המתלוננת התמודדה עם השאלות הרבות והקשות בענין הגשת התלונה וביטולה. את כיבוש תלונתה ניתן להסביר בכך שהנאשם היה האדם הקרוב אליה ביותר בבית, והוא שימש לה ""עזר כנגד"" אמה, וצידד בעמדתה בריבה עם אמה. משפגע בה, חשה כי אין לה עוד אל מי לפנות. עדותה של המתלוננת מלמדת בבירור, כי האם לא תמכה בה כלל ועיקר, לא האמינה לה, ולא סייעה לה בפתרון בעיותיה. ניתן להבין, אפוא, את חששה של המתלוננת לפנות אל אמה בצרתה. המתלוננת היתה בודדה במערכה זו ובהתמודדות עם אחת הבעיות הקשות בחייה. היא פנתה אל אמה, אך זו לא טיפלה בענין; היא פנתה אל אביה וזה שכנעה לחזור בה מן התלונה. רק אצל יניב מצאה אוזן קשבת, והוא זה שחיזק אותה ואימץ את רצונה להגיש את התלונה. לאחר החזרה מן התלונה, ניתקה כל קשר עם יניב. העובדת הסוציאלית היתה זו שחיזקה אותה ואמצה את ידיה להגיש את התלונה בפעם השניה. העובדה כי המתלוננת לא סיפרה את כל אשר אירע לה לעובדת הסוציאלית מיד בפגישות הראשונות, אין בה כדי להעיד כי תלונותיה וטענותיה אינן אמת. נערה במצבה של המתלוננת, שלא זכתה לאמון מצד משפחתה, מאבדת, בדרך כלל, אמון באנשים מבוגרים. עובר זמן, אם בכלל, עד שהיא שבה לרחוש אמון באנשים אחרים, לפתוח בפניהם את סגור לב ולספר להם על ענינים אינטימיים ופוגעים, ובעיקר על מעשים מיניים שביצע בה בן משפחה קרוב.",3,"עדות המתלוננת עקבית וברורה, ולא נמצאו סתירות בין הודעותיה במשטרה לבין עדותה",tagger3,not annotated
692744,m01000232," כמו כן, מצאתי כי גרסתה של המתלוננת לעניין האירועים איננה הגיונית ואיננה סבירה","התביעה מבססת את עיקר טיעוניה על עדותה של המתלוננת. אציין כבר עתה כי מצאתי סתירות מהותיות בעדותה. כמו כן, מצאתי כי גרסתה של המתלוננת לעניין האירועים איננה הגיונית ואיננה סבירה. יש לציין גם כי גרסתה של המתלוננת אינה מתיישבת בנקודות רבות עם גרסתה של עדת התביעה, חברתה של המתלוננת, אשר הייתה עמה בליל האירוע.",1," כמו כן, מצאתי כי גרסתה של המתלוננת לעניין האירועים איננה הגיונית ואיננה סבירה",tagger3,not annotated
