sentence_id,title,origin_sentence,paragraph_text,query number,clean_sentence,tagger,status
398579,s021336a, גירסתו של המתלונן היתה אמינה עלי ונמצאו לה ראיות מסייעות ומחזקות,"סוף דבר 17. גירסתו של המתלונן היתה אמינה עלי ונמצאו לה ראיות מסייעות ומחזקות. הנאשם לא הצליח להפריך את הגירסה ואף לא להעלות ספק סביר לדעתי, ועל כן הנני מרשיעו , כפי שהואשם, בביצוע מעשה מגונה, עבירה לפי  לחוק העונשין, התשל""ז - 1977.ב",1, גירסתו של המתלונן היתה אמינה עלי ונמצאו לה ראיות מסייעות ומחזקות,tagger3,not annotated
852029,SH-08-9929-69,  ההימנעות מלהתייחס לכך גורמת להחלשה ניכרת במשקל שניתן לתת לעדותה הכבושה של המתלוננת,תורנות הלילה של המתלוננת – כפי שתואר לעיל מבחינת המתלוננת המדובר היה באירוע קשה ומסעיר. המתלוננת תארה כי נמנעה מלרדת מהרכב במחסום וכן כי באותו לילה כאשר ביקר אותה דודו אוחנה הייתה נסערת וסיפרה לו מה היה. לצד דברים אלה הוברר כי באותו יום בלילה  אכן הייתה המתלוננת בעמדת הש.ג. אך נערכו לה שתי ביקורות על ידי לא אחר מאשר הנאשם. ביקורות אלה נמשכו רבע שעה ועשרים דקות. קשה להלום כי אירוע כזה של מפגש חוזר עם הנאשם – לפרקי זמן לא קצרים - מספר שעות לאחר האירוע נשתכח כליל מזיכרונה של המתלוננת.  ההימנעות מלהתייחס לכך גורמת להחלשה ניכרת במשקל שניתן לתת לעדותה הכבושה של המתלוננת. כאן המקום להזכיר כי החוקרת לא שאלה את המתלוננת על תורנות הש.ג. ושני המפגשים עם הנאשם באותו לילה משום שלא שמה לב לכך ולכן אין התייחסות של המתלוננת לקושי זה בשלב מוקדם יותר מאשר חקירתה בבית המשפט.,5,  ההימנעות מלהתייחס לכך גורמת להחלשה ניכרת במשקל שניתן לתת לעדותה הכבושה של המתלוננת,tagger3,not annotated
369031,SH-13-02-47-54," מקובלים עליי הסבריו של האחראי על החקירה, השוטר קץ, כי החקירה היתה נתונה בסד זמנים צפוף - הן עקב היותו של החשוד עצור, והן עקב העובדה שהמתלוננת היתה אמורה לחזור לארה""ב והיה צריך להספיק להשלים את החקירה, ובמידת הצורך להותיר זמן מספיק להגשת כתב-אישום ולגביית עדות מוקדמת מהמתלוננת טרם עזיבתה את הארץ (עמ' 46 לפרוטוקול)","כפי שצוין בפיסקה 6 לעיל, הסיבה לעריכת מסדר זיהוי תצלומי פנים במקרה דנן, נבעה מכך שלא נמצאו מספיק ניצבים כהי-עור על-מנת לבצע מסדר זיהוי חי. מקובלים עליי הסבריו של האחראי על החקירה, השוטר קץ, כי החקירה היתה נתונה בסד זמנים צפוף - הן עקב היותו של החשוד עצור, והן עקב העובדה שהמתלוננת היתה אמורה לחזור לארה""ב והיה צריך להספיק להשלים את החקירה, ובמידת הצורך להותיר זמן מספיק להגשת כתב-אישום ולגביית עדות מוקדמת מהמתלוננת טרם עזיבתה את הארץ (עמ' 46 לפרוטוקול). בשים לב לסד הזמנים הנטען, ומאחר שלא נמצאו די ניצבים כהי-עור על-מנת לבצע מסדר זיהוי חי, אני בדעה כי עצם ההחלטה לערוך מסדר זיהוי תמונות היתה סבירה. אף הסנגור לא טען אחרת בסיכומיו.",5," מקובלים עליי הסבריו של האחראי על החקירה, השוטר קץ, כי החקירה היתה נתונה בסד זמנים צפוף - הן עקב היותו של החשוד עצור, והן עקב העובדה שהמתלוננת היתה אמורה לחזור לארה""ב והיה צריך להספיק להשלים את החקירה, ובמידת הצורך להותיר זמן מספיק להגשת כתב-אישום ולגביית עדות מוקדמת מהמתלוננת טרם עזיבתה את הארץ ",tagger3,not annotated
532780,ME-15-10-1855-55,"מסכם זאת בית המשפט העליון (6) 205, 216 (2002) כדלקמן: ""מלשון הסעיף עולה כי בית-המשפט רשאי להסתמך על עדות יחידה של מתלוננת, ובלבד שיפרט מה הניע אותו להסתפק בעדות זו","מסכם זאת בית המשפט העליון (6) 205, 216 (2002) כדלקמן: ""מלשון הסעיף עולה כי בית-המשפט רשאי להסתמך על עדות יחידה של מתלוננת, ובלבד שיפרט מה הניע אותו להסתפק בעדות זו. זוהי דרישת ""ההנמקה המיוחדת"" שתפסה את מקומה של דרישת הסיוע שנדרשה בעבר לשם הרשעה בעבירת מין (ראו, למשל, דברי השופט אריאל ב גנדור נ' מדינת ישראל [פורסם בנבו] (להלן: ""עניין גנדור[1]), בעמ' 49-48). בהיעדר דרישת סיוע יכולה הכרעת-הדין להיות מושתתת על מימצאי המהימנות שקבע בית-המשפט ועליהם בלבד. אשר-על-כן מידת הזהירות מחייבת כי ההנמקה תהא ""ממשית"". ""...ככל שהעדות העיקרית 'חלשה' יותר, תידרש הנמקה 'ממשית' יותר..."" (י' קדמי על הראיות (להלן – קדמי [43]) (כרך א), בעמ' 159). למידת הפירוט הנדרשת לשם עמידה בחובת ההנמקה לא נקבע שיעור, והדבר ייקבע על-פי הנסיבות (ראו  פלוני נ' מדינת ישראל [2], בפיסקה 1 לפסק-דינו של השופט טל). עם זאת ברור כי כאשר התרשמותו של בית-המשפט ממהימנות המתלוננת נתמכת בראיות חיצוניות – די בכך כדי לספק את דרישת ההנמקה (קדמי (כרך א) [43], בעמ' 162). כך, למשל, נקבע כי תלונתה המיידית של מתלוננת או העובדה שהגיעה נרגשת ופרועה בעת הגשת תלונתה די בהן כדי לספק את אותו חיזוק הנדרש לשם עמידה בדרישת ההנמקה (עניין גנדור [1], בעמ' 50). מכוח קל וחומר, הגורמים הראייתיים שנקבעו בעבר כמספקים את דרישת הסיוע יספקו גם את חובת ההנמקה שבאה במקומה.""",5,"מסכם זאת בית המשפט העליון  205, 216  כדלקמן: ""מלשון הסעיף עולה כי בית-המשפט רשאי להסתמך על עדות יחידה של מתלוננת, ובלבד שיפרט מה הניע אותו להסתפק בעדות זו",tagger3,not annotated
354818,ME-11-02-34952-76,"נכון אמנם שהמתלוננת שהתה באולם ביהמ""ש בעת שחברותיה הנ""ל העידו ובטרם זומנה שנית לעדותה הנוספת, אך הן חברותיה של הנאשמת והן הנאשמת, עשו עלי רושם אמין ואיני רואה סיבה לפקפק באמינותן","נכון אמנם שהמתלוננת שהתה באולם ביהמ""ש בעת שחברותיה הנ""ל העידו ובטרם זומנה שנית לעדותה הנוספת, אך הן חברותיה של הנאשמת והן הנאשמת, עשו עלי רושם אמין ואיני רואה סיבה לפקפק באמינותן. אחרי, ככלות הכל, היתה זו דווקא חברתה של המתלוננת – ל', שחשפה ביוזמתה, את העובדה שהמתלוננת: ""כל הזמן שהייתי הולכת איתה ברחוב, כל הזמן היא היתה מדמיינת אותו. כל הזמן היתה ראה מישהו שחור וגבות ואומרת 'אני חושבת שזה הוא'"" (עמ' 30, ש' 23-25). דווקא אל מי שהעלתה ביוזמתה את העובדה שיצרה, אליבא דהסנגור, את הספק, יש להתייחס באמון גם כשהיא מפריכה בגרסתה את הספק.",17,"נכון אמנם שהמתלוננת שהתה באולם ביהמ""ש בעת שחברותיה הנ""ל העידו ובטרם זומנה שנית לעדותה הנוספת, אך הן חברותיה של הנאשמת והן הנאשמת, עשו עלי רושם אמין ואיני רואה סיבה לפקפק באמינותן",tagger3,not annotated
530086,s05003325-a,"עדותה המוקלטת של המתלוננת - צפיתי בעדותה המוקלטת של המתלוננת יותר מפעם, וכאמור לעיל, מצאתי אותה ראויה לאימון","עדותה המוקלטת של המתלוננת - צפיתי בעדותה המוקלטת של המתלוננת יותר מפעם, וכאמור לעיל, מצאתי אותה ראויה לאימון. העדות מתאפיינת באיפוק וריסון. תיאור השתלשלות האירוע נמסר בצורה שקולה ומאוזנת. מהעדות המצולמת עולה בבירור שהקטינה לא היתה מונעת ברצון להחמיר מצבו של הנאשם ולטפול עליו אשמת שווא. היא תיארה את האירוע באופן מינורי ובצורה עיקבית, ואותות האמת ניכרו בדבריה. המתלוננת אמרה שהבחינה לראשונה  ברחוב אמרי חיים, כשפנה אליה בשאלות מוזרות כגון ""עוד כמה זמן שבת"", שאלה חסרת פשר לכשעצמה, בהתחשב בכך שהאירוע קרה ביום א' בשבוע. הפניה הפחידה את המתלוננת, היא התחילה לגמגם, הפנתה גבה והחישה צעדיה לביתה. תוך כדי כך הרגישה המתלוננת ביד שנגעה בחלק התחתון של ישבנה, שכוונה אל בין רגליה. בעניין זה, שהוא לב האישום הראשון, שאלה החוקרת את המתלוננת שאלות רבות, ועל כולן השיבה המתלוננת תשובות מאופקות ומדודות. המתלוננת סיפרה, שהנגיעה היתה מעל לחצאיתה ולא עמוק מידי (ת/2ג עמ' 6 ש' 159 ועמ' 9 ש' 228). המתלוננת לא שיקרה ולא טענה שראתה את הנאשם ברגע המעשה. לעומת זאת הדגימה את הנגיעה כמה וכמה פעמים, והסבירה שצורת המגע הביא אותה לשלילת אפשרות שהנגיעה היתה אקראית, ולתובנה שלא ניתן ""לדון את הנאשם לכף זכות"", כפי שנטתה לעשות מלכתחילה. המתלוננת הגיעה לביתה במצב נפשי נסער ופרצה בבכי וכפי שהעידה: ""אני עליתי הביתה שלי והתחלתי לבכות"" (ת/2ג עמ' 9 ש' 243).",12,"עדותה המוקלטת של המתלוננת - צפיתי בעדותה המוקלטת של המתלוננת יותר מפעם, וכאמור לעיל, מצאתי אותה ראויה לאימון",tagger3,not annotated
5052,ME-16-11-9004-33," מחד, מצויה גרסתה המפלילה של המתלוננת, בתו החורגת של הנאשם, המתארת, כפי שנראה להלן, בצורה מפורטת, עקבית וסדורה, סדרה של מעשים שביצע בה הנאשם מאז הייתה בת 8 ועד לחשיפתם, בשנת 2014","ראשית, יש ליתן הדעת לכך, שבמקרים אלה, לא אחת, וכך - בענייננו, ניצבים אנו בפני שתי גרסאות סותרות וקוטביות זו לזו. מחד, מצויה גרסתה המפלילה של המתלוננת, בתו החורגת של הנאשם, המתארת, כפי שנראה להלן, בצורה מפורטת, עקבית וסדורה, סדרה של מעשים שביצע בה הנאשם מאז הייתה בת 8 ועד לחשיפתם, בשנת 2014. מנגד, מצויה גרסת הנאשם, המכחיש מכל וכל, כי ביצע את המעשים המיוחסים לו, וטוען, כי המתלוננת מעלילה עליו עלילות שווא. מצב זה, של ""גרסה מול גרסה"", כמו גם הכחשה גורפת מצדו של נאשם, הוא שכיח באישומים בעבירות מין, המאופיינות בביצוע המעשים בצנעה, בחדרי חדרים, בשעות ובסביבה שבהן אין בנמצא עדים למעשה, ושבהם רב הנסתר על הנגלה. משום כך - ברי, שבאישומים בכגון דא, מתמקד הדיון בהערכת מהימנות גרסת המתלוננת, אל מול הערכת מהימנות גרסת הנאשם.",5," מחד, מצויה גרסתה המפלילה של המתלוננת, בתו החורגת של הנאשם, המתארת, כפי שנראה להלן, בצורה מפורטת, עקבית וסדורה, סדרה של מעשים שביצע בה הנאשם מאז הייתה בת 8 ועד לחשיפתם, בשנת 2014",tagger3,not annotated
707532,ME-10-09-31383-790, עדות המתלוננת הייתה מהימנה לחלוטין בעיניי,"ה. דיון 1. ממצאי מהימנות וניתוח הראיות 17. עדות המתלוננת הייתה מהימנה לחלוטין בעיניי. המתלוננת הייתה קוהרנטית, כנה, עקבית ומעוררת אמון. עדות המתלוננת הייתה סדורה, והמתלוננת לא התבלבלה אף שסיפרה על אירוע בן שלבים אחדים. לא מצאתי כי יש סתירות מהותיות בדברי המתלוננת. אי ההתאמות בעדויות התביעה, לרבות בעדות המתלוננת, לא היו משמעותיות, ואינן פוגמות בעדותה המהימנה וברושם האמין שהותירה המתלוננת.",3, עדות המתלוננת הייתה מהימנה לחלוטין בעיניי,tagger3,not annotated
140313,ME-09-1084-867," בעוד שגרסת המתלוננת לגבי מעשה הסדום הייתה מהימנה, כנה, עקבית וקוהרנטית – גרסתה באשר לאי הסכמתה לקיום יחסי המין הווגינאליים באירוע השני, נשוא האישום באינוס, מעוררת תהיות ממשיות","האישום באינוס 24. בעוד שגרסת המתלוננת לגבי מעשה הסדום הייתה מהימנה, כנה, עקבית וקוהרנטית – גרסתה באשר לאי הסכמתה לקיום יחסי המין הווגינאליים באירוע השני, נשוא האישום באינוס, מעוררת תהיות ממשיות.",3," בעוד שגרסת המתלוננת לגבי מעשה הסדום הייתה מהימנה, כנה, עקבית וקוהרנטית – גרסתה באשר לאי הסכמתה לקיום יחסי המין הווגינאליים באירוע השני, נשוא האישום באינוס, מעוררת תהיות ממשיות",tagger3,not annotated
566725,me-09-02-142920,גרסתה המפלילה של המתלוננת כפי שבאה לידי ביטוי בעדותה בפנינו הותירה רושם מהימן וכי אמת בפיה,"גרסתה המפלילה של המתלוננת כפי שבאה לידי ביטוי בעדותה בפנינו הותירה רושם מהימן וכי אמת בפיה. דבריה נאמרו מעומק הלב תוך שסיפרה את סיפורה בכנות רבה. דבריה הברורים והעקביים נאמרו תוך שהיא מביטה בנאשם אשר דווקא הוא נדמה, השפיל לא אחת את מבטו.",5,גרסתה המפלילה של המתלוננת כפי שבאה לידי ביטוי בעדותה בפנינו הותירה רושם מהימן וכי אמת בפיה,tagger3,not annotated
769762,ME-15-11-34046-11,"""מלשון הסעיף עולה כי בית-המשפט רשאי להסתמך על עדות יחידה של מתלוננת, ובלבד שיפרט מה הניע אותו להסתפק בעדות זו","""מלשון הסעיף עולה כי בית-המשפט רשאי להסתמך על עדות יחידה של מתלוננת, ובלבד שיפרט מה הניע אותו להסתפק בעדות זו. זוהי דרישת ""ההנמקה המיוחדת"" שתפסה את מקומה של דרישת הסיוע שנדרשה בעבר לשם הרשעה בעבירת מין (ראו, למשל, דברי השופט אריאל ב גנדור נ' מדינת ישראל [פורסם בנבו] (להלן - עניין גנדור [1]), בעמ' 49-48). בהיעדר דרישת סיוע יכולה הכרעת-הדין להיות מושתתת על מימצאי המהימנות שקבע בית-המשפט ועליהם בלבד.""",5,"""מלשון הסעיף עולה כי בית-המשפט רשאי להסתמך על עדות יחידה של מתלוננת, ובלבד שיפרט מה הניע אותו להסתפק בעדות זו",tagger3,not annotated
577046,ME-08-1120-436,גרסת המתלוננת מעורפלת ובלתי בהירה,"גרסת המתלוננת מעורפלת ובלתי בהירה. ביחס לנאשם – אין בפיה גרסה של ממש. למעט ציון העובדה לפיה ""נגע"" בה הנאשם – התמונה נותרה עלומה, ללא פירוט הנסיבות; היכן נגע בה לכאורה, כיצד ומה קדם לנגיעה הנטענת. לא ניתן אפוא לבסס ממצא עובדתי על יסוד גרסת המתלוננת.",3,גרסת המתלוננת מעורפלת ובלתי בהירה,tagger3,not annotated
534024,ME-15-10-1855-55,"במקרה דנן כאמור, מצאתי את עדותה של המתלוננת ש' מהימנה ביותר, הן באשר לסיפור ההתרחשות והן לגבי זיהויו של הנאשם כמי שתקף אותה, ועדותה זו היא נדבך מרכזי בראיות המאשימה לחובתו","במקרה דנן כאמור, מצאתי את עדותה של המתלוננת ש' מהימנה ביותר, הן באשר לסיפור ההתרחשות והן לגבי זיהויו של הנאשם כמי שתקף אותה, ועדותה זו היא נדבך מרכזי בראיות המאשימה לחובתו.",5,"במקרה דנן כאמור, מצאתי את עדותה של המתלוננת ש' מהימנה ביותר, הן באשר לסיפור ההתרחשות והן לגבי זיהויו של הנאשם כמי שתקף אותה, ועדותה זו היא נדבך מרכזי בראיות המאשימה לחובתו",tagger3,not annotated
827429,m99000948,"כפי שכבר ציינתי לעיל, המתלוננת עשה עלי רושם מהימן ולא היתה לה כל עילה להעליל על הנאשם","כפי שכבר ציינתי לעיל, המתלוננת עשה עלי רושם מהימן ולא היתה לה כל עילה להעליל על הנאשם.",17,"כפי שכבר ציינתי לעיל, המתלוננת עשה עלי רושם מהימן ולא היתה לה כל עילה להעליל על הנאשם",tagger3,not annotated
176527,s05003504-333,"הנאשם, עדי ההגנה והסניגור בסכומיו מדגישים כולם את נוכחות השותף בדירה כעוגן הצלה והוכחה ניצחת כי גירסת המתלוננת אינה סבירה ולא יתכן כי הרימה קול, בכתה או צעקה והשותף לא שמע ולא הבחין בכך","הנאשם, עדי ההגנה והסניגור בסכומיו מדגישים כולם את נוכחות השותף בדירה כעוגן הצלה והוכחה ניצחת כי גירסת המתלוננת אינה סבירה ולא יתכן כי הרימה קול, בכתה או צעקה והשותף לא שמע ולא הבחין בכך.",7,"הנאשם, עדי ההגנה והסניגור בסכומיו מדגישים כולם את נוכחות השותף בדירה כעוגן הצלה והוכחה ניצחת כי גירסת המתלוננת אינה סבירה ולא יתכן כי הרימה קול, בכתה או צעקה והשותף לא שמע ולא הבחין בכך",tagger3,not annotated
396834,m06003039,"איני סבור, כפי שגורס בא כוח הנאשם, כי מאופן עדותה של המתלוננת, המצומצמת והשטחית בתוכן וברגש, יש ללמוד כי לא היו דברים מעולם","איני סבור, כפי שגורס בא כוח הנאשם, כי מאופן עדותה של המתלוננת, המצומצמת והשטחית בתוכן וברגש, יש ללמוד כי לא היו דברים מעולם. תאוריה זו עשויה להיות נכונה במקרים רבים, אך לא במקרה זה.",4,"איני סבור, כפי שגורס בא כוח הנאשם, כי מאופן עדותה של המתלוננת, המצומצמת והשטחית בתוכן וברגש, יש ללמוד כי לא היו דברים מעולם",tagger3,not annotated
502992,m02001206," בכל הנוגע למעשה האינוס עצמו - גם כאן גירסתה של המתלוננת ברורה, עִקבית וחד-משמעית","61. בכל הנוגע למעשה האינוס עצמו - גם כאן גירסתה של המתלוננת ברורה, עִקבית וחד-משמעית. היא לא נסתרה בחקירתה הנגדית שבּה עוד הוסיפה והסבירה את השתלשלות העניינים, את הרגשותיה, את בקשותיה מִן הנאשם שיניח לה וגם את אשר אירע למחרת היום וּבימים שלאחריו.",1," בכל הנוגע למעשה האינוס עצמו - גם כאן גירסתה של המתלוננת ברורה, עִקבית וחד-משמעית",tagger3,not annotated
727116,ME-12-08-3491-22,"על כן, לנוכח העובדה שהמתלוננת העידה עדות מלאה בפנינו, הן בחקירה ראשית והן בחקירה נגדית, יכולנו להתרשם מעדותה באופן בלתי אמצעי","על כן, לנוכח העובדה שהמתלוננת העידה עדות מלאה בפנינו, הן בחקירה ראשית והן בחקירה נגדית, יכולנו להתרשם מעדותה באופן בלתי אמצעי. ניתן לקבל כראייה את חוות דעתה של חוקרת הילדים המיוחדת, וכנספח לה את התרשמותה מאמינות עדותה של הילדה, וזאת, במסגרת עדותה של חוקרת הילדים ככל עדות איש מקצוע אשר יכול לחוות דעתו.",8,"על כן, לנוכח העובדה שהמתלוננת העידה עדות מלאה בפנינו, הן בחקירה ראשית והן בחקירה נגדית, יכולנו להתרשם מעדותה באופן בלתי אמצעי",tagger3,not annotated
525547,m03001069," אמנם נכון הדבר כי בכל הנוגע למעשה האונס עצמו - עדותה של המתלוננת היא העדות היחידה, ועומדת היא כנגד גירסתו של הנאשם","89. אמנם נכון הדבר כי בכל הנוגע למעשה האונס עצמו - עדותה של המתלוננת היא העדות היחידה, ועומדת היא כנגד גירסתו של הנאשם. עם זאת, וּמשעה שאין עוד צורך בסיוע לעדוּת נפגע בעבירת מין, דומני כי לנוכח פירוט גירסתה של המתלוננת כולה, והתרשמותי ממהימנותה וַאֲמִינוּתָהּ כִּכְלַל, וּמעדותה באשר לאירוע האונס בפרט, השתלבותו של אירוע שכזה במכלול התנהגותו הַאַלִּימָה והאובססיבית של הנאשם כפי שְׁהוּכְחָה בפנינו, כאוֹת של אמת, כמו גם העובדה כי הנאשם קָשַׁר את עצמו לאירוע, שאת קיומו הכחיש תחילה לחלוטין - הכל כפי שהוּכח לעיל - אין מקום לפקפּק באשר לְאֲמִינוּת גירסתה של המתלוננת כי הנאשם אכן כפה עצמו עליה וקִיֵּים עימה יחסי-מין בניגוד לרצונה.",14," אמנם נכון הדבר כי בכל הנוגע למעשה האונס עצמו - עדותה של המתלוננת היא העדות היחידה, ועומדת היא כנגד גירסתו של הנאשם",tagger3,not annotated
532858,ME-15-10-1855-55,"בעטיין של עבירות מין, נקבע לא פעם כי אין מקום לדרוש כי עדות המתלוננת תהיה סדורה, עקבית, חפה מכל אי דיוק, על מנת שיינתן בה אמון","בעטיין של עבירות מין, נקבע לא פעם כי אין מקום לדרוש כי עדות המתלוננת תהיה סדורה, עקבית, חפה מכל אי דיוק, על מנת שיינתן בה אמון.",2,"בעטיין של עבירות מין, נקבע לא פעם כי אין מקום לדרוש כי עדות המתלוננת תהיה סדורה, עקבית, חפה מכל אי דיוק, על מנת שיינתן בה אמון",tagger3,not annotated
