sentence_id,title,origin_sentence,paragraph_text,query number,clean_sentence,tagger,status
637608,s05001698,4) גירסת המתלוננת ביחס למקום ההתרחשות אינה אחידה,"4) גירסת המתלוננת ביחס למקום ההתרחשות אינה אחידה. במשטרה טענה המתלוננת שהאירוע התרחש ליד הקומקום, ואילו בבית המשפט טענה שהאירוע התרחש ביציאה מהחדר (פרוטוקול, עמוד 7, שורה 1).",7,4) גירסת המתלוננת ביחס למקום ההתרחשות אינה אחידה,tagger3,not annotated
403778,m06003027-239,"מיני-רציו: * ראיות – עדות – עדות יחידה עדות יחידה של מתלוננת בעבירת מין נגד הנאשם הוגש כתב אישום המייחס לו ביצוע עבירות מין בבתו, בגין מעשים שבוצעו לפני כ-4 שנים","מיני-רציו: * ראיות – עדות – עדות יחידה עדות יחידה של מתלוננת בעבירת מין נגד הנאשם הוגש כתב אישום המייחס לו ביצוע עבירות מין בבתו, בגין מעשים שבוצעו לפני כ-4 שנים. הנאשם הכחיש את המיוחס לו וטען כי תלונת הבת היא שקרית.",5,"מיני-רציו: * ראיות – עדות – עדות יחידה עדות יחידה של מתלוננת בעבירת מין נגד הנאשם הוגש כתב אישום המייחס לו ביצוע עבירות מין בבתו, בגין מעשים שבוצעו לפני כ-4 שנים",tagger3,not annotated
377542,ME-06-1098-81,"בהכרעת הדין נדחתה גרסת הבדים של הנאשם לפיה המתלוננת היא זונה שהסכימה למין בתשלום, קבענו, כי גרסת המתלוננת מהימנה והרשענו את הנאשם על פי העובדות הבאות שפורטו בכתב האישום:","בהכרעת הדין נדחתה גרסת הבדים של הנאשם לפיה המתלוננת היא זונה שהסכימה למין בתשלום, קבענו, כי גרסת המתלוננת מהימנה והרשענו את הנאשם על פי העובדות הבאות שפורטו בכתב האישום:",7,"בהכרעת הדין נדחתה גרסת הבדים של הנאשם לפיה המתלוננת היא זונה שהסכימה למין בתשלום, קבענו, כי גרסת המתלוננת מהימנה והרשענו את הנאשם על פי העובדות הבאות שפורטו בכתב האישום:",tagger3,not annotated
409888,ME-20-01-13777-33," במצבו הרפואי האמור, גם ביקש להסביר את הסבריו הדלים ואת חוסר יכולתו להתמודד מול גרסתן המפורטת של המתלוננות לאירועים","28. אוסיף, כי התנהלותו המגמתית של הנאשם באה לידי ביטוי גם בניסיונו לדחות את מועד עדותו לפנינו, תוך טענה כי איננו כשיר לעדות בשל מצבו הנפשי ובשל כך שהוא נוטל טיפול תרופתי. במצבו הרפואי האמור, גם ביקש להסביר את הסבריו הדלים ואת חוסר יכולתו להתמודד מול גרסתן המפורטת של המתלוננות לאירועים.",5," במצבו הרפואי האמור, גם ביקש להסביר את הסבריו הדלים ואת חוסר יכולתו להתמודד מול גרסתן המפורטת של המתלוננות לאירועים",tagger3,not annotated
405971,SH-09-5632-267,עדותה המהימנה של המתלוננת,עדותה המהימנה של המתלוננת,5,עדותה המהימנה של המתלוננת,tagger3,not annotated
528058,ME-12-03-25945-23," הנאשם החדיר אצבע/ות לתוך איבר מינה של המתלוננת - ההגנה טענה (עמ' 9-10 לסיכומיה): גירסת המתלוננת כי הנאשם החדיר את אצבעותיו לגופה איננה עקבית והיא לא סיפרה על כך בבדיקה הגופנית, וגם לא לסתיו ורן, ובכך עולים ספקות בגירסתה","17. הנאשם החדיר אצבע/ות לתוך איבר מינה של המתלוננת - ההגנה טענה (עמ' 9-10 לסיכומיה): גירסת המתלוננת כי הנאשם החדיר את אצבעותיו לגופה איננה עקבית והיא לא סיפרה על כך בבדיקה הגופנית, וגם לא לסתיו ורן, ובכך עולים ספקות בגירסתה. דינן של טענות ההגנה להידחות: א. כעולה מחוות הדעת נ/9, המתלוננת לא סיפרה לפרופ' היס על החדרת אצבעות.ואולם: המתלוננת העידה בביהמ""ש שהיא לא יודעת למה היא לא סיפרה על כך לרופא, היא זוכרת שהיא סיפרה על כך ליעל והמתלוננת הסבירה שהיא כבר סיפרה את הסיפור הזה באותו יום כל כך הרבה פעמים שהיא לא זוכרת אם היא סיפרה להיס או לא (עמ' 19 לפר' מיום 9.10.12, שו' 10, 23, 26-27), והוסיפה שמרוב שהיא סיפרה את הסיפור הזה הרבה פעמים היא שכחה לספר לו (עמ' 20 לפר', שו' 1). המתלוננת ציינה שעם יעל (עת/2) היא דיברה בשקט לבד ולכן לה היא סיפרה (עמ' 20 לפר', שו' 15-16). הסברה של המתלוננת סביר ומתקבל על הדעת. ואכן עת/2 יעל סיפרה במשטרה: ""היא (המתלוננת-ג'נ') אמרה...הוא דחף לי אצבעות בניגוד לרצוני"" (נ/2, ע' 1, שו' 16), וכך גם יעל העידה בבהמ""ש: ""... אני זוכרת שנטען על ידיה שהוא דחף לה אצבעות..."" (ע' 34 מ-15.10.12, ש' 26-27).",3," הנאשם החדיר אצבע/ות לתוך איבר מינה של המתלוננת - ההגנה טענה : גירסת המתלוננת כי הנאשם החדיר את אצבעותיו לגופה איננה עקבית והיא לא סיפרה על כך בבדיקה הגופנית, וגם לא לסתיו ורן, ובכך עולים ספקות בגירסתה",tagger3,not annotated
527963,ME-12-03-25945-23," המתלוננת לא ראתה את הקעקוע (התמונה נ/10) שעל רגלו הימנית של הנאשם: ההגנה טענה (עמ' 5-6 לסיכומי ההגנה): אם גירסת המתלוננת היא נכונה, אין סיכוי בעולם שהיא לא היתה מבחינה בקעקוע שעל רגלו של הנאשם לאחר שהוא הוריד את מכנסיו (ותחתוניו)","12. המתלוננת לא ראתה את הקעקוע (התמונה נ/10) שעל רגלו הימנית של הנאשם: ההגנה טענה (עמ' 5-6 לסיכומי ההגנה): אם גירסת המתלוננת היא נכונה, אין סיכוי בעולם שהיא לא היתה מבחינה בקעקוע שעל רגלו של הנאשם לאחר שהוא הוריד את מכנסיו (ותחתוניו). ואולם, דינה של הטענה להידחות: העובדה שהמתלוננת לא ראתה את הקעקוע, איננה גורעת ממהימנותה. אנמק: א. המתלוננת העידה בכנותה שלא היה אור אבל היא יכלה לראות (עמ' 16 לפר' מיום 9.10.12, שו' 29). המתלוננת נשאלה בין השאר, והשיבה ברור וחד משמעית: ""ש. את זוכרת אם הדלת הייתה סגורה...ת. סגורה לגמרי...ש. ...איך יכול להיות שאת הקעקוע לא ראית? ת. כי זה דלת וזה קעקוע."" (עמ' 17 לפר', שו' 23-28). זהו הסבר סביר ומתקבל על הדעת. ב. השלב שבו הנאשם הפשיל את מכנסיו התרחש אחרי שהנאשם כבר החדיר אצבע אחת או שתיים מאצבעותיו לתוך איבר מינה (בעדות המתלוננת בבית המשפט - עמ' 6 לפר', שו' 24-27, ובעדותה במשטרה – נ/1, עמ' 2, שו' 30-31). היינו מדובר בשלב יחסית מתקדם של האירוע, כשהמתלוננת אומרת לנאשם תוך כדי שיפסיק, לא, די, והיא בהלם, כמפורט לעיל בעדותה. על כן, סביר שבאותן נסיבות המתלוננת לא נתנה דעתה לקעקוע של הנאשם. ג. הקעקוע הוא על ירכו הימנית של הנאשם (התמונה נ/10); גם אם לצורך בירור נקודה זו אקבל את גירסת הנאשם שלפיה הוא והמתלוננת ישבו באלכסון אחד ליד השני והתנשקו והתחבקו (עמ' 42 לפר' מיום 31.10.12, שו' 18, 23) – ואינני מקבלה – הרי שלפי גירסתו, בסיטואציה פיזית ""צמודה"" מעין זו, לא בהכרח ניתן לראות, כשהנאשם מפשיל את מכנסיו, את הקעקוע שעל רגלו. ד. המתלוננת לא נשאלה על הקעקוע במשטרה – לא בחקירתה וגם לא בעימות עם הנאשם. לראשונה היא נשאלה על כך בחקירתה הנגדית, היינו בחלוף כ-7 חודשים מהאירוע. בנסיבות אלה, סביר כי המתלוננת לא בהכרח תזכור את דבר קיומו של הקעקוע. ה. בעימות במשטרה, המתלוננת אמרה לנאשם בין השאר: ""הורדת את המכנסיים שלך..."" (ת/4, ע' 2, שו' 10). ואילו הנאשם לא אמר בתגובה דבר על הקעקוע שהמתלוננת היתה אמורה לראות ושעליו היא לא מדברת (ת/4, עמ' 2, שו' 23 ואילך). ו. התמונה נ/10 הוגשה כמוצג בהסכמת התביעה, ואולם אציין שאין בפני ביהמ""ש ראייה לגבי מועד יצירת קעקוע זה. ז. הנאשם העיד: ""...אם הייתי מוריד את המכנסיים היא הייתה רואה את הקעקוע שלי, איך מזגה אקסל בחושך מה היא לא רואה כלום."" (עמ' 39 לפר', שו' 13-14). ואולם: כאמור, לא נמצאו טביעות אצבע של המתלוננת על כוס בחדר (ת/11, ת/12), וממילא היא לא מזגה אקסל, וכפועל יוצא, הקישור העולה מעדות הנאשם שבאותה מידה היא היתה צריכה לראות את הקעקוע, אין לו על מה שיסמוך. ח. הנאשם לא דיבר על הקעקוע לא במשטרה ולא במענה לאישום [בשולי הדברים: שלא כנטען בסיכומי ההגנה (הע""ש 1 עמ' 5), ביהמ""ש כן סימן את תמונת הקעקוע כמוצג (נ/10), וזאת ב-11.11.12 – היינו כחודש וחצי לפני שהוגשו סיכומי ההגנה לבהמ""ש (ראו גם את החלטת ביהמ""ש מ-11.11.12 להוסיף התמונה כמוצג)].",7," המתלוננת לא ראתה את הקעקוע  שעל רגלו הימנית של הנאשם: ההגנה טענה : אם גירסת המתלוננת היא נכונה, אין סיכוי בעולם שהיא לא היתה מבחינה בקעקוע שעל רגלו של הנאשם לאחר שהוא הוריד את מכנסיו ",tagger3,not annotated
630816,ME-12-09-42383-690,"יש לציין כי גרסת המתלוננת בעניין זה לא היתה שונה מהגרסה שמסרה בעת חקירתה על ידי חוקרת הילדים, יום לאחר האירוע (ראו ת/2 עמ' 9-8, 20)","יש לציין כי גרסת המתלוננת בעניין זה לא היתה שונה מהגרסה שמסרה בעת חקירתה על ידי חוקרת הילדים, יום לאחר האירוע (ראו ת/2 עמ' 9-8, 20).",3,"יש לציין כי גרסת המתלוננת בעניין זה לא היתה שונה מהגרסה שמסרה בעת חקירתה על ידי חוקרת הילדים, יום לאחר האירוע ",tagger3,not annotated
328874,SH-09-07-14045-107,כאן המקום לציין כי המתלוננת הותירה רושם אמין ביותר,"כאן המקום לציין כי המתלוננת הותירה רושם אמין ביותר. עדותה הייתה שוטפת, מדויקת ומלאת פרטים. דמעות עמדו בעיניה כשתיארה את האירוע בחדר השירותים, ואף ביתר חלקי העדות ניכרה התאמה מלאה בין תוכן הדברים לבין ביטוים הרגשי. הסבריה, גם כשנגעו לשאלות קשות, דוגמת הימנעותה משיתוף אחרים במתרחש, היו משכנעים ומתקבלים על הדעת, והיא היטיבה לשדר את המצוקה הקשה שבה הייתה נתונה, כאשר מחד לא יכולה הייתה להרשות לעצמה לוותר על מקום העבודה ומאידך נאלצה להתמודד באופן תדיר עם מעשיו הנלוזים של הנאשם. לנוכח התרשמותי זו אני נותן משקל מלא לעדות המתלוננת, ומה גם שדבריה נתמכים בראיות נוספות, כפי שיובהר מייד.",17,כאן המקום לציין כי המתלוננת הותירה רושם אמין ביותר,tagger3,not annotated
851409,ME-10-07-21310-4,"לכל אלה, נלוו כאמור, על פי עדותה המצמררת של המתלוננת, ואף מתיעוד החבלות שנמצאו בגופה ובאיבריה המוצנעים לאחר האירוע, איומי הנאשם על חייה, ואף תקיפתה ממש תוך גרימת חבלות בגופה","לכל אלה, נלוו כאמור, על פי עדותה המצמררת של המתלוננת, ואף מתיעוד החבלות שנמצאו בגופה ובאיבריה המוצנעים לאחר האירוע, איומי הנאשם על חייה, ואף תקיפתה ממש תוך גרימת חבלות בגופה.",5,"לכל אלה, נלוו כאמור, על פי עדותה המצמררת של המתלוננת, ואף מתיעוד החבלות שנמצאו בגופה ובאיבריה המוצנעים לאחר האירוע, איומי הנאשם על חייה, ואף תקיפתה ממש תוך גרימת חבלות בגופה",tagger3,not annotated
488295,m02001067-568," על-אף שבוטלה דרישת הסיוע לעדות יחידה של מתלוננת בעבירת-מין, הובאו בפנינו ע""י המאשימה עדויות נוספות במטרה לתמוך ולאמת את גרסת המתלוננת, ולחזק את אמינותה","ראיות ה""עיבוי"" מטעם המאשימה 25. על-אף שבוטלה דרישת הסיוע לעדות יחידה של מתלוננת בעבירת-מין, הובאו בפנינו ע""י המאשימה עדויות נוספות במטרה לתמוך ולאמת את גרסת המתלוננת, ולחזק את אמינותה. בנוסף לעדות המתלוננת, מבקשת המאשימה להישען על שלושה אדנים עיקריים נוספים: גרסתו השקרית, לטענתה, של הנאשם; מצבה הנפשי של המתלוננת לאחר ביצוע העבירות ותלונתה המיידית.",5," על-אף שבוטלה דרישת הסיוע לעדות יחידה של מתלוננת בעבירת-מין, הובאו בפנינו ע""י המאשימה עדויות נוספות במטרה לתמוך ולאמת את גרסת המתלוננת, ולחזק את אמינותה",tagger3,not annotated
174938,ME-11-06-33989-11," לזה יש להוסיף, כי עדויות המתלוננות היו מהימנות בעיני","כמו כן יצוין, כי הוכח מעדויות א""א, ר' והמתלוננות כי שני ענפי משפחה אלה לא היו בקשר ממשי, אלא נפגשו באירועים מיוחדים בלבד, כמו למשל ב""שבעה"" לאחות הקטנה ז' ז""ל (ואף הנאשם אישר כי כשהתגורר אצל ר' וא""א, לא היה קשר ביניהן); ועובדה זו פוגמת בטענת ""העלילה המתואמת"" של הנאשם. מעבר לכך, טענתו מופרכת לאור העובדה שהמתלוננות דיווחו על מקרים שונים ועל שוני בין המעשים (מלבד הדמיון בהחדרת האצבעות), והדבר מלמד כי אין מדובר בפרי דמיון משותף. באם היה מדובר בעלילה, נכון בעיני כי המתלוננות היו מתארות את המעשים באופן חמור יותר (ובמיוחד מ.א.), והיו מציגות זיכרון טוב יותר באשר לפרטי המעשים ומועדם. לזה יש להוסיף, כי עדויות המתלוננות היו מהימנות בעיני.",3," לזה יש להוסיף, כי עדויות המתלוננות היו מהימנות בעיני",tagger3,not annotated
589333,ME-10-02-20190-1,"אמנם שיקר הנאשם בחקירותיו ובלתי אמין מצאתיו בעדותו ""הכבושה"", אך משלא שכנעה המאשימה, כפי חובתה על פי דין, כי גירסת המתלוננת אמינה ומהימנה מעבר לכל ספק סביר, לא ניתן להרשיעו","אמנם שיקר הנאשם בחקירותיו ובלתי אמין מצאתיו בעדותו ""הכבושה"", אך משלא שכנעה המאשימה, כפי חובתה על פי דין, כי גירסת המתלוננת אמינה ומהימנה מעבר לכל ספק סביר, לא ניתן להרשיעו.",3,"אמנם שיקר הנאשם בחקירותיו ובלתי אמין מצאתיו בעדותו ""הכבושה"", אך משלא שכנעה המאשימה, כפי חובתה על פי דין, כי גירסת המתלוננת אמינה ומהימנה מעבר לכל ספק סביר, לא ניתן להרשיעו",tagger3,not annotated
178492,s05001085-150,"משקבעתי כי גרסת המתלוננת אמינה עלי, ובדחותי את גירסת ההגנה, אני קובעת כי הוכחו יסודות העבירות שיוחסו לנאשם בכתב האישום מעבר לכל ספק סביר","משקבעתי כי גרסת המתלוננת אמינה עלי, ובדחותי את גירסת ההגנה, אני קובעת כי הוכחו יסודות העבירות שיוחסו לנאשם בכתב האישום מעבר לכל ספק סביר.",3,"משקבעתי כי גרסת המתלוננת אמינה עלי, ובדחותי את גירסת ההגנה, אני קובעת כי הוכחו יסודות העבירות שיוחסו לנאשם בכתב האישום מעבר לכל ספק סביר",tagger3,not annotated
176082,SH-08-7183-220,עדותה של המתלוננת עשתה רושם אמין על בית המשפט,"עדותה של המתלוננת עשתה רושם אמין על בית המשפט. אמנם ב""כ הנאשם טען לסתירות בין עדותה במשטרה לבין עדותה בבית המשפט. בהקשר זה, אציין שב""כ הנאשם לא ביקש להגיש את הודעת העדה כראיה לצורך השוואת הסתירות. לעומת זאת, שינויים מסויימים ולא מהותיים רק מחזקים את אמינותה של המתלוננת שלא מדובר בעדות כוזבת הנובעת מקנוניה בין המתלוננת לבין אשורי נגד הנאשם. אדרבא, אדם שחווה את המעשים המתוארים בכתב האישום צפוי להיות בסערת רגשות. טבעי שמתלוננת בעקבות אירועים כגון דא לא שמה לב לפרטים קטנים שאירעו כמו האם הדלת הייתה פתוחה או חצי פתוחה. כעולה מעדותה, הפרטים המהותיים והמרכזיים בעדותה של המתלוננת נותרו כפי שהעידה בתלונתה במשטרה. אמנם, לכאורה, יש סתירה בעדותה לגבי התרחשות המעשה המגונה לפני או אחרי שהנאשם נכנס לשירותים. אולם, אין סתירה ממשית לגבי מעשים המתוארים על ידי המתלוננת, המעשים שאין חולק שאם התרחשו, הם נכנסים לגדר הסעיף.",9,עדותה של המתלוננת עשתה רושם אמין על בית המשפט,tagger3,not annotated
774258,SH-18-01-42624-345,"בפנינו גרסה מידית נוספת של המתלוננת, ובכלל זה גרסה המלמדת על התנהגות קודמת של הנאשם כלפיה בעלת  נופך מיני","בפנינו גרסה מידית נוספת של המתלוננת, ובכלל זה גרסה המלמדת על התנהגות קודמת של הנאשם כלפיה בעלת  נופך מיני.",5,"בפנינו גרסה מידית נוספת של המתלוננת, ובכלל זה גרסה המלמדת על התנהגות קודמת של הנאשם כלפיה בעלת  נופך מיני",tagger3,not annotated
510200,SH-11-04-25817-739," עדותה של המתלוננת היא כאמור העדות העיקרית מטעם התביעה, והיא גם העדות היחידה לגבי האירוע נשוא כתב האישום, שכן, בעת האירוע נכחו המתלוננת והנאשם בלבד","30. עדותה של המתלוננת היא כאמור העדות העיקרית מטעם התביעה, והיא גם העדות היחידה לגבי האירוע נשוא כתב האישום, שכן, בעת האירוע נכחו המתלוננת והנאשם בלבד.",14," עדותה של המתלוננת היא כאמור העדות העיקרית מטעם התביעה, והיא גם העדות היחידה לגבי האירוע נשוא כתב האישום, שכן, בעת האירוע נכחו המתלוננת והנאשם בלבד",tagger3,not annotated
534158,ME-15-10-1855-55," כוונתי היא בעיקר לעדותה המהימנה ביותר של המתלוננת בפנינו; התיאור המפורט שמסרה לשוטרים ולאמה מיד לאחר האירוע התואם בפרטים מרכזיים את התיאור שמסרה המתלוננת ה' באישום השני ואשר על בסיסו, בין היתר, מצאנו כאמור כי יש להרשיע את הנאשם באישום זה","בענייננו הרשעת הנאשם נשענת על מספר אדנים שונים המשלימים זה את זה ומצטרפים זה לזה, ולא על מסדר הזיהוי לבדו. כוונתי היא בעיקר לעדותה המהימנה ביותר של המתלוננת בפנינו; התיאור המפורט שמסרה לשוטרים ולאמה מיד לאחר האירוע התואם בפרטים מרכזיים את התיאור שמסרה המתלוננת ה' באישום השני ואשר על בסיסו, בין היתר, מצאנו כאמור כי יש להרשיע את הנאשם באישום זה.",5," כוונתי היא בעיקר לעדותה המהימנה ביותר של המתלוננת בפנינו; התיאור המפורט שמסרה לשוטרים ולאמה מיד לאחר האירוע התואם בפרטים מרכזיים את התיאור שמסרה המתלוננת ה' באישום השני ואשר על בסיסו, בין היתר, מצאנו כאמור כי יש להרשיע את הנאשם באישום זה",tagger3,not annotated
551194,ME-12-5501-303,"סוף דבר לעניין מעשי האינוס הרשעה בעבירת מין על סמך עדות יחידה של מתלוננת, דורשת הנמקה מיוחדת כאשר ההנמקה חלה על כל עבירה בנפרד ועוצמתה נגזרת מעוצמת העדות ועוצמת הבעיות המכרסמות בה","סוף דבר לעניין מעשי האינוס הרשעה בעבירת מין על סמך עדות יחידה של מתלוננת, דורשת הנמקה מיוחדת כאשר ההנמקה חלה על כל עבירה בנפרד ועוצמתה נגזרת מעוצמת העדות ועוצמת הבעיות המכרסמות בה.",5,"סוף דבר לעניין מעשי האינוס הרשעה בעבירת מין על סמך עדות יחידה של מתלוננת, דורשת הנמקה מיוחדת כאשר ההנמקה חלה על כל עבירה בנפרד ועוצמתה נגזרת מעוצמת העדות ועוצמת הבעיות המכרסמות בה",tagger3,not annotated
661561,m021063,"מדֶרך הטבע, ועל-אף שבוטלה דרישת הסיוע לעדוּת יחידה של מתלוננת בעבירות-מין, הובאו בפנינו ראיות נוספות במטרה לעבּוֹת, לחזק וּלאמת את גירסת המתלוננת","מדֶרך הטבע, ועל-אף שבוטלה דרישת הסיוע לעדוּת יחידה של מתלוננת בעבירות-מין, הובאו בפנינו ראיות נוספות במטרה לעבּוֹת, לחזק וּלאמת את גירסת המתלוננת. ראיות אלה מתייחסות לכֹל שלושת רבדֵי גירסת המתלוננת, כמו גם לטענת ה""אליבי"" שהעלה הנאשם.",5,"מדֶרך הטבע, ועל-אף שבוטלה דרישת הסיוע לעדוּת יחידה של מתלוננת בעבירות-מין, הובאו בפנינו ראיות נוספות במטרה לעבּוֹת, לחזק וּלאמת את גירסת המתלוננת",tagger3,not annotated
